{
  "slug": "bizon-m-2",
  "name": {
    "en": "Bizon M-2",
    "pl": "Bizon M-2",
    "fr": "Bizon M-2",
    "de": "Bizon M-2",
    "pt-BR": "Bizon M-2"
  },
  "description": {
    "en": "Plenty of power on dry asphalt. Weak on gravel and in the rain.",
    "pl": "Dużo mocy na suchym asfalcie. Słaby na żwirze i w deszczu.",
    "fr": "Beaucoup de puissance sur asphalte sec. Faible sur gravier et sous la pluie.",
    "de": "Viel Leistung auf trockenem Asphalt. Schwach auf Schotter und im Regen.",
    "pt-BR": "Muita potência no asfalto seco. Fraco no cascalho e na chuva."
  },
  "class": "muscle",
  "drivetrain": "rwd",
  "powertrain": "ice",
  "engine": { "layout": "V6", "displacement_l": 3.2, "tune": 1.0 },
  "power_kw": 202,
  "mass_kg": 1480,
  "top_speed_kmh": 200,
  "clearance": 15,
  "cargo_kg": 80,
  "seats": 2,
  "tank_l": 60,
  "tier": 3,
  "min_player_level": 6,
  "price_cents": 3400000,
  "sources": ["start", "exchange"]
}
